{
  "adapter_id": "browser_dom.sample",
  "adapter_version": "0.1.0",
  "source_type": "browser",
  "platform": "web",
  "capabilities": {
    "can_receive": true,
    "can_send": false,
    "can_capture_screenshot": false,
    "can_read_dom": true,
    "can_identify_thread": true,
    "can_verify_target": false,
    "requires_user_confirmation": true
  },
  "metadata": {
    "sample_only": true,
    "real_execution_default": false,
    "allowed_artifact_types": ["html", "dom_snapshot", "text_extract"]
  }
}
