{
  "adapter_id": "business_api.sample",
  "adapter_version": "0.1.0",
  "source_type": "api",
  "platform": "business_system",
  "capabilities": {
    "can_receive": true,
    "can_send": false,
    "can_capture_screenshot": false,
    "can_read_dom": false,
    "can_identify_thread": true,
    "can_verify_target": true,
    "requires_user_confirmation": true
  },
  "metadata": {
    "sample_only": true,
    "real_execution_default": false,
    "allowed_artifact_types": ["json_snapshot"],
    "input_mode": "saved_api_snapshot_file"
  }
}
